tone,description
Assertive and Insight-Driven,"The email doesn't ask what the customer needs; it tells the customer what they are missing. It delivers a surprising, well-researched reframe to disrupt the status quo, aiming for a referral or a discussion about the insight, not the product."
Empathetic and Value-Focused,"Used for leads who are ""not yet sales-ready."" It adopts a helpful, patient tone, providing highly relevant, high-value content for their specific role or pain point, nurturing them through the process without pushing for a sale."
Collaborative and Trust-Building,"Used after initial engagement, or when reaching multiple stakeholders. The email focuses on tailoring the message to align with the recipient's goals (e.g., ""This helps the CFO achieve X and the VP of Ops achieve Y""). It positions the seller as an equal partner in achieving a defined business outcome."
Concise and Direct,"This is the classic Cold Calling 2.0 tone. The email is deliberately short, targeting a high-level executive (e.g., the CEO) with a single, low-commitment request: ""Who is the best person on your team"" to discuss a specific, high-level business problem."
Clear and Action-Oriented,"Used for late-stage opportunities (Bottom of Funnel). The tone is all about removing friction and providing final-stage content and assurance (e.g., case studies, implementation plans, pricing structure) to drive the final decision and close the deal."